name,price
Nescafe Kopi Instant Classic 10X2G,Rp 13.900
Kapal Api Kopi Bubuk Special 150G,Rp 25.500
Kapal Api Kopi Bubuk Special 90G,Rp 15.500
Gadjah Kopi Tubruk Manis 2 In 1 10X25g,Rp 19.900
Kapal Api Kopi Bubuk Special 20X6G,Rp 22.900
Good Day Kopi Instant 3 In 1 Mocacinno 10X20g,Rp 16.300
Kapal Api Kopi Bubuk Special Mix 10X23g,Rp 20.500
Kapal Api Kopi Bubuk Special Merah 350G,Rp 58.900
Luwak Kopi Bubuk+Gula (5+2) 23G,Rp 8.900
Kapal Api Kopi Bubuk Special Mix 20X23g,Rp 39.900
Top Coffee Kopi Cappuccino 6X25g,Rp 14.600
Kapal Api Kopi Susu 10X31g,Rp 20.500
Fresco Kopi Instant Cappuccino 9X25g,Rp 14.900
Kopi Kenangan Hanya Untukmu Coffee Drink Black Aren 220mL,Rp 9.700
Nescafe Kopi Instant Ice Roast Americano 10X2G,Rp 13.900
Neo Coffee Kopi Instant (6+3) Caramel Machiato 180g,Rp 10.800
Kapal Api Kopi Bubuk Less Sugar Special Mix 10X21g,Rp 20.000
Nescafe Coffee Classic Kemasan Ekonomi 45g,Rp 25.500
Abc Kopi Susu Instant Gula Aren 9X27G,Rp 11.900
Good Day Kopi Instant Cappuccino W/Coklat Granul 10X25g,Rp 25.000
Kapal Api Kopi One + Gula Terpisah 10X23G,Rp 16.900
Kapal Api Kopi Bubuk Gula Aren Special Mix 10X23g,Rp 20.800
Neo Coffee Kopi Instant (6+3) Moccachino 180G,Rp 10.800
Neo Coffee Kopi Instant (6+3) Tiramisu 180g,Rp 10.800
Pikopi Kopi Instant (6+3) Gula Aren 9X22G,Rp 12.600
Top Coffee Kopi Gula Aren Tubruk 9x27g,Rp 11.400
Top Coffee Kopi Instant 3 In 1 (12+6) Gula Aren 396G,Rp 26.600
Good Day Kopi Instant 3 In 1 Duet Moca'caramel 5X22G,Rp 8.900
Top Coffee Kopi Gula Susu 3 In 1 10X31g,Rp 17.400
Nescafe Coffee Drink Gula Aren 220mL,Rp 7.300
Kopi Kenangan Hanya Untukmu Coffee Drink Mantancino 220mL,Rp 9.700
Good Day Kopi Instant 3 In 1 Chococinno 10X20g,Rp 16.300
Luwak White Koffie Less Sugar 9X19G,Rp 17.900
Torabika Kopi Instant Creamy Latte 10X22g,Rp 22.200
Kopi Kenangan Hanya Untukmu Coffee Drink Caffe Latte 200mL,Rp 7.700
Pikopi Kopi Mix Instant 3 In 1 9X20g,Rp 10.900
Starbucks Doubleshot Coffee Drink Caramel Latte 220mL,Rp 15.400
Luwak White Coffee Original 18X20g,Rp 35.100
Luwak White Koffie 3 Rasa 10X20g,Rp 17.100
Luwak White Koffie Original 9x20G,Rp 17.500
Starbucks Doubleshot Coffee Drink Espresso Latte 220mL,Rp 15.400
Top Coffee Kopi Instant 3 In 1 (6+3) Mokachinno 198g,Rp 14.000
Caffino Coffee Ready To Drink Milky Espresso 200mL,Rp 7.800
Indocafe Coffee Mix 5X20g,Rp 9.800
Indocafe Cappuccino 10X25g,Rp 26.000
Luwak Coffee Drink Kopi + Gula 220mL,Rp 5.800
Nescafe Coffee Drink Oat Latte 220mL,Rp 8.300
Abc Coffee Drink Milk Coffee 200Ml,Rp 4.200
Good Day Kopi Instant 3 In 1 Vanilla Latte 10X20g,Rp 16.300
Good Day Coffee Drink Groovy Cookies 250mL,Rp 7.200
Nescafe Coffee Drink Cappuccino 220Ml,Rp 7.300
Nescafe Coffee Drink Latte 220Ml,Rp 7.300
Abc Coffee Drink Chocomalt Coffee 200Ml,Rp 4.200
Indocafe Coffee Mix 3 In 1 10X20G,Rp 18.500
Nescafe Coffee Drink Ice Black 220mL,Rp 7.300
Nescafe Coffee Drink Caramel Macchiato 220Ml,Rp 7.300
Caffino Coffee Ready To Drink Oat Marrie 200mL,Rp 7.800
Nescafe Ice Coffee Original 220mL,Rp 10.900
Nescafe Ice Coffee Latte 220mL,Rp 10.900
Nescafe Ice Coffee Mocha 220mL,Rp 10.900
Good Day Coffee Drink Tiramisu Bliss 250Ml,Rp 7.200
Nescafe Coffee Cream 180Ml,Rp 5.800
Kapal Api Coffee Drink Signature Strong Black Coffee 200mL,Rp 6.500
Ichitan Thai Milk Coffee Drink 300mL,Rp 8.600
Indocafe Coffee Mix 30X20g,Rp 53.400
Good Day Coffee Drink Avocado Delight 250Ml,Rp 7.200
Luwak White Koffie Original 220Ml,Rp 7.600
Good Day Coffee Drink Funtasic Mocacinno 250Ml,Rp 7.200
Good Day Coffee Drink Cappuccino 250Ml,Rp 7.200
Caffino Coffee Ready To Drink Oat Cappuccino 200mL,Rp 7.800
Golda Coffee Drink Cappuccino 200mL,Rp 4.000
Luwak White Koffie Tarik Malaka 6X30g,Rp 17.900
Torabika Cappuccino Extra Choco Granule 10X25g,Rp 27.500
Top Coffee Gula Aren Instant 9X22G,Rp 14.000
Good Day Coffee Freeze 3In1 Cookies N Cream 5X30g,Rp 14.900
